{
  "schema_version": "0.1",
  "protocol": {
    "id": "proof-of-existence-license-protocol",
    "name": "Proof-of-Existence License Protocol",
    "abbreviation": "PoEL",
    "version": "0.1"
  },
  "license_certificate": {
    "license_id": "poel-license-human-001",
    "subject_id": "kazene-human-001",
    "subject_type": "human",
    "public_key": "ed25519:human_public_key_001",
    "key_algorithm": "ed25519",
    "issued_at": "2026-04-25T00:00:00Z",
    "expires_at": null,
    "issuer_id": "kazene-proof-of-existence-os",
    "issuer_signature": "ed25519:issuer_signature_001",
    "status": "active"
  },
  "trace_record": {
    "trace_id": "trace-human-001",
    "trace_type": "specification",
    "trace_hash": "sha256:abc123humantrace001",
    "hash_algorithm": "sha256",
    "created_at": "2026-04-25T00:10:00Z",
    "signed_at": "2026-04-25T00:11:00Z",
    "signed_by": "kazene-human-001",
    "license_id": "poel-license-human-001",
    "signature": "ed25519:trace_signature_001",
    "visibility": "hash_only",
    "metadata": {
      "title": "Proof-of-Existence License Protocol v0.1",
      "language": "ja"
    }
  },
  "merkle_anchor_record": {
    "anchor_id": "anchor-human-001",
    "merkle_root": "sha256:abc123humanmerkleroot001",
    "tree_algorithm": "binary_merkle_tree",
    "hash_algorithm": "sha256",
    "anchored_at": "2026-04-25T01:00:00Z",
    "ledger_type": "transparency_log",
    "ledger_ref": "ledger:human-reference-001",
    "included_trace_count": 128
  },
  "merkle_inclusion_proof": {
    "trace_hash": "sha256:abc123humantrace001",
    "merkle_root": "sha256:abc123humanmerkleroot001",
    "proof_path": [
      "sha256:humanproofnode001",
      "sha256:humanproofnode002"
    ],
    "proof_verified": true
  },
  "claim": {
    "claim_id": "claim-human-001",
    "claim_type": "contribution_claim",
    "subject_id": "kazene-human-001",
    "license_id": "poel-license-human-001",
    "trace_id": "trace-human-001",
    "merkle_root": "sha256:abc123humanmerkleroot001",
    "claim_status": "pending_verification",
    "claim_note": "A valid human subject contribution claim."
  },
  "verification_result": {
    "license_verified": true,
    "signature_verified": true,
    "merkle_inclusion_verified": true,
    "claim_eligible": true,
    "verified_at": "2026-04-25T01:30:00Z",
    "verifier_id": "kazene-verifier-001"
  }
}
